{
  "schemaVersion": 1,
  "datasetStatus": "observed-public-tychara",
  "source": {
    "url": "https://tychara.com/StarSavior/characterlist/",
    "sourceLastUpdated": "2026-06-29",
    "verifiedInAsiaClient": false
  },
  "generatedAt": "2026-09-21T03:05:21.926Z",
  "characters": [
    {
      "slug": "ceres",
      "name": "Ceres",
      "pageUrl": "https://tychara.com/StarSavior/characters/ceres/",
      "lastUpdated": null,
      "profileEn": "Ceres – striker SSR (moon). Stats, skills, potentials, and build guide for Star Savior.",
      "iconUrl": "https://tychara.com/StarSavior/characterimg/charicons/ceresicon.webp",
      "fullArtUrl": "https://tychara.com/StarSavior/characterimg/fullart/ceresfullart.webp",
      "stats": {
        "attack": 3456,
        "vitality": 18420,
        "defense": 1434,
        "speed": 106,
        "criticalHitRate": null,
        "criticalDamage": null
      },
      "skills": [
        {
          "type": "passive",
          "banner": "Passive",
          "name": "Order by Force",
          "descriptionEn": "Increases self ATK by 15%. Grants self 2 stacks of Chill at the start of the first battle. Fills self action gauge by 35% proportional to the number of targets hit after using 7th Form: Earthshaker (up to 175%). Increases damage dealt by 30% if the enemy is under the effects of Freeze upon using 1st Form: Crescent Moon or 21st Form: Blade Gale.",
          "iconUrl": "https://tychara.com/StarSavior/skills/Order%20by%20Force.webp"
        },
        {
          "type": "basic",
          "banner": "Basic",
          "name": "1st Form: Crescent Moon",
          "descriptionEn": "Charges alone and attacks the enemy in an instant. Grants self 1 stack of Chill.",
          "iconUrl": "https://tychara.com/StarSavior/skills/1st%20Form:%20Crescent%20Moon.webp"
        },
        {
          "type": "special",
          "banner": "Special",
          "name": "7th Form: Earthshaker",
          "descriptionEn": "Channels powerful force into two blades, then slams down to attack all enemies. 100% chance to remove 1 buff from all enemies. 100% chance to inflict 2 stacks of Freeze each on all enemies for 2 turns. 100% chance to inflict Isolation on all enemies for 2 turns. Grants self 1 stack of Chill.",
          "iconUrl": "https://tychara.com/StarSavior/skills/7th%20Form:%20Earthshaker.webp"
        },
        {
          "type": "ultimate",
          "banner": "Ultimate",
          "name": "21st Form: Blade Gale",
          "descriptionEn": "Overwhelms the enemy with countless slashes that surge like a storm. Grants self Western Winds for 3 turns. 100% chance to inflict Stun on the enemy for 1 turn. 100% chance to reduce the enemy's action gauge by 20%. Action Gauge Reduction increases by 10% for each stack of Chill on self (up to 5 stacks). Removes all stacks of Chill after attacking.",
          "iconUrl": "https://tychara.com/StarSavior/skills/21st%20Form:%20Blade%20Gale.webp"
        }
      ]
    },
    {
      "slug": "annah",
      "name": "Annah",
      "pageUrl": "https://tychara.com/StarSavior/characters/annah/",
      "lastUpdated": null,
      "profileEn": "Annah – defender SR (sun). Stats, skills, potentials, and build guide for Star Savior.",
      "iconUrl": "https://tychara.com/StarSavior/characterimg/charicons/AnnahIcon.webp",
      "fullArtUrl": "https://tychara.com/StarSavior/characterimg/fullart/AnnahFullArt.webp",
      "stats": {
        "attack": 2552,
        "vitality": 17338,
        "defense": 1342,
        "speed": 95,
        "criticalHitRate": null,
        "criticalDamage": null
      },
      "skills": []
    },
    {
      "slug": "asherah",
      "name": "Asherah",
      "pageUrl": "https://tychara.com/StarSavior/characters/asherah/",
      "lastUpdated": null,
      "profileEn": "Asherah – striker SSR (moon). Stats, skills, potentials, and build guide for Star Savior.",
      "iconUrl": "https://tychara.com/StarSavior/characterimg/charicons/AsherahIcon.webp",
      "fullArtUrl": "https://tychara.com/StarSavior/characterimg/fullart/AsherahFullArt.webp",
      "stats": {
        "attack": 3005,
        "vitality": 20086,
        "defense": 1560,
        "speed": 104,
        "criticalHitRate": null,
        "criticalDamage": null
      },
      "skills": [
        {
          "type": "passive",
          "banner": "Passive",
          "name": "Stranis Style Breathing",
          "descriptionEn": "Increases Asherah's ATK by 5%.",
          "iconUrl": "https://tychara.com/StarSavior/skills/Stranis%20Style%20Breathing.webp"
        },
        {
          "type": "basic",
          "banner": "Basic",
          "name": "Stranis Style Slash",
          "descriptionEn": "Charges toward the enemy and delivers an upward slash. Grants self 1 stack of Chill.",
          "iconUrl": "https://tychara.com/StarSavior/skills/Stranis%20Style%20Slash.webp"
        },
        {
          "type": "special",
          "banner": "Special",
          "name": "Veil Cleave",
          "descriptionEn": "Partially unleashes her magic blade's power to slash all enemies. Grants self SPD Up for 2 turns.",
          "iconUrl": "https://tychara.com/StarSavior/skills/Veil%20Cleave.webp"
        },
        {
          "type": "ultimate",
          "banner": "Ultimate",
          "name": "Dawn of Night",
          "descriptionEn": "Temporarily lifts the magic blade's seal to deal devastating damage to all enemies. Grants self CRIT Rate Up for 2 turns.",
          "iconUrl": "https://tychara.com/StarSavior/skills/Dawn%20of%20Night.webp"
        }
      ]
    },
    {
      "slug": "asherahwaltzofstarlight",
      "name": "Asherah Waltz of Starlight",
      "pageUrl": "https://tychara.com/StarSavior/characters/asherahwaltzofstarlight/",
      "lastUpdated": null,
      "profileEn": "Asherah Waltz of Starlight – supporter SSR (order). Stats, skills, potentials, and build guide for Star Savior.",
      "iconUrl": "https://tychara.com/StarSavior/characterimg/charicons/AsherahWaltzofStarlightIcon.webp",
      "fullArtUrl": "https://tychara.com/StarSavior/characterimg/fullart/AsherahWaltzofStarlightFullArt.webp",
      "stats": {
        "attack": 3005,
        "vitality": 20086,
        "defense": 1560,
        "speed": 104,
        "criticalHitRate": null,
        "criticalDamage": null
      },
      "skills": [
        {
          "type": "passive",
          "banner": "Passive",
          "name": "L'unisson",
          "descriptionEn": "Increases Asherah's Max HP by 5%.",
          "iconUrl": "https://tychara.com/StarSavior/skills/L'unisson.webp"
        },
        {
          "type": "basic",
          "banner": "Basic",
          "name": "Belle Lame",
          "descriptionEn": "Rushes the enemy and delivers a powerful upward slash. Grants self 1 stack of Insight. DMG is proportional to self Max HP.",
          "iconUrl": "https://tychara.com/StarSavior/skills/Belle%20Lame.webp"
        },
        {
          "type": "special",
          "banner": "Special",
          "name": "Bal Doré",
          "descriptionEn": "Emits radiant light and unleashes a blade aura to attack the enemy. Restores all allies' HP. Grants self Starlight Wish (Undispellable) for 2 turns and 1 stack of Insight. DMG and Recovery are proportional to self Max HP.",
          "iconUrl": "https://tychara.com/StarSavior/skills/Bal%20Dor%C3%A9.webp"
        },
        {
          "type": "ultimate",
          "banner": "Ultimate",
          "name": "Lumière Sonnet",
          "descriptionEn": "Walks out on a red carpet to welcome allies. Restores all allies' HP and removes 2 debuffs from them, then increases all allies' (excluding self) Action Gauge by 15%. Grants self 1 stack of Insight. Recovery is proportional to self Max HP.",
          "iconUrl": "https://tychara.com/StarSavior/skills/Lumi%C3%A8re%20Sonnet.webp"
        }
      ]
    },
    {
      "slug": "bellrhys",
      "name": "Bell Rhys",
      "pageUrl": "https://tychara.com/StarSavior/characters/bellrhys/",
      "lastUpdated": null,
      "profileEn": "Bell Rhys – ranger SSR (star). Stats, skills, potentials, and build guide for Star Savior.",
      "iconUrl": "https://tychara.com/StarSavior/characterimg/charicons/BellrhysIcon.webp",
      "fullArtUrl": "https://tychara.com/StarSavior/characterimg/fullart/BellRhysFullArt.webp",
      "stats": {
        "attack": 3230,
        "vitality": 18420,
        "defense": 1434,
        "speed": 112,
        "criticalHitRate": null,
        "criticalDamage": null
      },
      "skills": [
        {
          "type": "passive",
          "banner": "Passive",
          "name": "Approaching Rest",
          "descriptionEn": "Increases Bell's Action Gauge by 30% and self ATK by 6% each time an ally or enemy (excluding self) is defeated. ATK increase stacks up to 3 times.",
          "iconUrl": "https://tychara.com/StarSavior/skills/Approaching%20Rest.webp"
        },
        {
          "type": "basic",
          "banner": "Basic",
          "name": "Obituary",
          "descriptionEn": "Unleashes cursed energy to attack the enemy. Grants self 1 stack of Leap.",
          "iconUrl": "https://tychara.com/StarSavior/skills/Obituary.webp"
        },
        {
          "type": "special",
          "banner": "Special",
          "name": "Condolence",
          "descriptionEn": "Binds multiple enemies with a curse and attacks all enemies. Inflicts all enemies with ACC Down for 2 turns with a 50% chance. Grants self SPD Up for 2 turns and 3 stacks of Leap.",
          "iconUrl": "https://tychara.com/StarSavior/skills/Condolence.webp"
        },
        {
          "type": "ultimate",
          "banner": "Ultimate",
          "name": "Encoffin",
          "descriptionEn": "Attacks the enemy with the darkness of the underworld. Inflicts the enemy with Silence for 2 turns with a 75% chance and removes all buffs from them with a 100% chance. Deals 30% increased damage if Leap is at max stacks on attack.",